totalResults,brandId,brandName,categoryId,categoryName,helpful,productId,productName,rating,review,reviewDate,reviewId,thumbnail,userName,votes,skinType,skinTone,skinUndertone,hairColor,hairType,hairTexture,eyeColor,ageRange,reviews
62,1622,CeraVe,22,Sunscreen,2,160671,Sunscreen Face Lotion SPF 50,2,"I don&#039;t really like this sunscreen. It&#039;s greasy and thick. This does not work well under makeup at all, but to be fair maybe they didn&#039;t intend for it to be used that way.
So I gave this to my husband in an effort to not waste money, because he works outside. The times he does use it (which honestly I think is only when I&#039;ve basically put it on him myself lol) it is a little hard to rub in and even makes his usually dry face feel greasy. 
I just don&#039;t really have any good things to say about this. I have used it while going to the beach a few times, but only because I didn&#039;t want to bring my more expensive sunscreen with me to the beach lol. It does prevent sunburn, so there&#039;s that! I won&#039;t be repurchasing this.",2019-03-26T19:56:00.000Z,3048189,thumb/h/145/2_0_6_6_2409382.JPG,tomatocheese,2,Oily,Fair,Unknown,Brown,Unknown,Unknown,Brown,25-29,9
62,1622,CeraVe,22,Sunscreen,3,160671,Sunscreen Face Lotion SPF 50,2,"The only uses I have for this is when my skin is too irritated for chemical sunscreens, and when I&#039;m swimming outside on holiday e.g. the Mediterranean. It is a physical sunscreen with zinc &amp; titanium dioxide, which do leave a white cast on the skin. Using the recommended quarter teaspoon results in an ashy white film on the skin - it is NOT invisible at all. It also contains niacinamide, an ingredient I like very much, but the formula in this really lets it down. I cannot find a way to use this under my make-up that doesn&#039;t result in patchiness, settling into pores, and a strange film-like quality where I can see it coating all the fine vellus hairs on my face.  No make-up base, primer, or foundation I&#039;ve tried can counteract this, there&#039;s just this off-putting waxy effect of the sunscreen film and patchy uneven base on top. It is tremendously unflattering to say the least and will amplify the appearance of the most minute of dry skin flakes, making them super noticeable . For these reasons, I only use this when I&#039;m not wearing base make-up - while irritated skin is healing, and when I&#039;m swimming and exposed to strong sunlight. It is a functional physical sunscreen with good SPF50 protection in fairness, but its cosmetic effects are abysmal. I won&#039;t be repurchasing this any time soon.",2018-10-02T20:02:00.000Z,3031646,thumb/h/145/2_0_6_6_2409382.JPG,rsg5062,3,Combination,Fair,Neutral,Brunette,Wavy,Fine,Hazel,25-29,199
62,1622,CeraVe,22,Sunscreen,3,160671,Sunscreen Face Lotion SPF 50,2,"I really don&#039;t like this sunscreen, and that makes me sad, because I normally love Cerave products.  I bought this because I wanted to try a sunscreen I could easily get in the US instead of having to order expensive Euro sunscreens online.  Avobenzone makes my face burn when I perspire, so I decided to get a physical-only sunscreen, and I chose this one due to my fondness for Cerave.  Well, the first time I applied it, my face looked a mess.  The sunscreen clung to every area of my face and it also left a terrible white cast on my very light skin.  I attributed it to the fact that my oily, thick skin was not well-exfoliated, so I put this product aside and hit the hydroxy acids and the Differin hard and got my skin to looking better and smoother.  Then I tried this product again.  It still looked awful and I looked like I was wearing a white mask.  Also, it stung.  I don&#039;t know what caused that, but I was surprised.  I will not buy this again.  I went ahead and ordered a highly-protective Euro chemical sunscreen (sans Avobenzone) from frenchcosmeticsforless.com and I will see how that goes.  In the meantime, I will use this Cerave product on my hands. ",2018-07-18T16:54:00.000Z,3023441,thumb/h/145/2_0_6_6_2409382.JPG,sullivan,3,Combination,Fair,Neutral,Brunette,Wavy,Fine,Brown,56 & Over,55
62,1622,CeraVe,22,Sunscreen,1,160671,Sunscreen Face Lotion SPF 50,1,"Awful. I mean, sure, it probably shields your skin from harmful rays. BUT - it also applies in a thick, ghostly layer that never fully dries down. In my non-sunless tanner state I am pale (usually the lightest foundation color, or 2nd to lightest) and this made me just literally white. Not figuratively...literally. 

Takes time to dry down, and even when it does, it still sits on top of skin in a layer. Makeup does not sit nicely on top of this. Nope, it makes the foundation cakey and thick and blech. Stongly dislike this formula. 

Hoping I can return this. I tried it twice. It does not work for me at all. Would not even wear alone without foundation! Or on my body! 

Pros: available in drugstores, tube is handy and hygienic.
Cons: absolutely everything else. ",2018-07-02T14:22:00.000Z,3021644,thumb/h/145/2_0_6_6_2409382.JPG,nebbe,1,Normal,Fair,Neutral,Blond,Wavy,Fine,Gray,36-43,47
62,1622,CeraVe,22,Sunscreen,2,160671,Sunscreen Face Lotion SPF 50,1,"This is the absolute worst sunscreen I have ever used. It&#039;s extremely cakey, white and pasty, and it looks incredibly patchy. I don&#039;t normally like most of cerave&#039;s products at this point. I&#039;ve tried the daily moisturizer too that has spf and it was terrible too. For a brand that&#039;s so highly recommended by dermatologists their sunscreens are pretty shit. I&#039;m kind of pale, a little rosy, but this stuff is just too white. &quot;Invisible zinc&quot; my ass. I can&#039;t imagine anyone would use this and think and think it&#039;s good. ",2018-04-18T08:20:00.000Z,3012877,thumb/h/145/2_0_6_6_2409382.JPG,Noogi,2,Normal,Fair,Unknown,Blond,Unknown,Unknown,Gray,19-24,2
62,1622,CeraVe,22,Sunscreen,5,160671,Sunscreen Face Lotion SPF 50,5,"I really like this sunscreen, but I can also see why it might be problematic for a lot of people.  It does dry with a slight whitish cast - for me personally, this has the effect of brightening my skin because I am so insanely pale.  If you are not the color of a freshly disinterred corpse, this whitish cast might be too much.  I haven&#039;t experienced any issues with my sensitive skin, and this seems to do its job guarding against sun damage.  Not the most moisturizing product in the world, so if you have very dry skin this might not be the one for you.",2017-07-20T09:26:00.000Z,2975126,thumb/h/145/2_0_6_6_2409382.JPG,maxmommy2,5,Combination,Fair,Unknown,Blond,Unknown,Unknown,Blue,30-35,96
62,1622,CeraVe,22,Sunscreen,2,160671,Sunscreen Face Lotion SPF 50,5,"Okay, okay - I&#039;m in the minority here as other reviewers totally hate this product, but for me, it works well.

I can&#039;t really use chemical sunscreens as they make my sensitive skin react.  Everything breaks me out and/or causes my rosacea to get even worse, so it&#039;s a double whammy as sun is no good for rosacea either.  On top of that, I&#039;ve started using a retinol product (MUAC .30% - great stuff BTW) so now I&#039;ve REALLY got to be careful with sun.

So here is how I get this Cerave mineral sunscreen to work for me: first off, I mix a pea-size dab of Embroylisse Lait-Creme with 2 drops of MUAC argan oil and apply that to my face and neck.  I let it sit a few minutes and then apply the Cerave, (AFTER SHAKING IT), working in small sections.   And yep, it does &quot;dry&quot; with a whitish film, which is the nature of the beast of zinc/TO sunscreens.  I have pale skin, so it&#039;s not that big a deal to me and it actually helps to even out all the red on my face AND I then apply a couple of layers of mineral makeup (Monave or Suncat) over that.   My makeup mostly looks great doing this (unfortunately, some of the worse of my &quot;fine lines&quot; are more noticeable, but again, I have layers of stuff on my face), and it holds up well until the night.  Granted I am pushing 60 and have dry skin (don&#039;t know how this would hold up with younger, oily skin), but as they say YMMV.  

Removing all of the layers is a 2 step process: first oil makeup remover (I like Silk Naturals) and then a face wash.  My skin feels good, not dry or tight, and all the stuff is removed.  

This product is not going to work well or many people, and lots of makeups are not going to work with it (thus people having issues with their makeup or sunscreen &quot;balling up&quot;). If you use mineral or powder makeup it works.  If you decide to give it a try, buy it from a store with a good return policy and keep the receipt. &quot;nuff said. ",2017-06-15T13:34:00.000Z,2969344,thumb/h/145/2_0_6_6_2409382.JPG,12catcrazy,2,Sensitive,Fair-Medium,Not Sure,Red,Wavy,Fine,Gray,56 & Over,24
62,1622,CeraVe,22,Sunscreen,2,160671,Sunscreen Face Lotion SPF 50,1,"Geez. i love just about everything cerave so when it was on bogo i picked this up. I&#039;m not very picky about sunscreens but this is awful! as everyone has already mentioned, this will make your face white! i am ridiculously pale and stay out of the sun but this is like geisha paint! it settles into every nook and cranny too. pass on this.",2017-05-11T12:53:00.000Z,2963214,thumb/h/145/2_0_6_6_2409382.JPG,inthiscity,2,Sensitive,Fair,Warm,Black,Other,Medium,Brown,30-35,84
62,1622,CeraVe,22,Sunscreen,0,160671,Sunscreen Face Lotion SPF 50,1,"Wow. This is the worst sunscreen I have ever tried. I nearly chose to go without with a UV index of 11, because a terrible burn may have been less embarrassing than the white glaze on everything with this mess. Imagine rubbing enough antiperspirant on your bathing suit and body to ball up and leave a film and you have this product. Love cerave, but this went in the trash. I don&#039;t know how this is sold in stores. ",2017-05-05T21:04:00.000Z,2962046,thumb/h/145/2_0_6_6_2409382.JPG,Elm691,0,Normal,Fair-Medium,Unknown,Blond,Unknown,Unknown,Brown,30-35,7
62,1622,CeraVe,22,Sunscreen,0,160671,Sunscreen Face Lotion SPF 50,1,"I wanted to like this sunscreen. It definitely leaves a white cast, and I&#039;m very fair. That doesn&#039;t bother me as much as how badly it&#039;s breaking me out! My skin has never hated a product so much.",2017-02-24T21:54:00.000Z,2948542,thumb/h/145/2_0_6_6_2409382.JPG,LarkeT,0,Combination,Fair,Unknown,Red,Unknown,Unknown,Blue,25-29,1
62,1622,CeraVe,22,Sunscreen,5,160671,Sunscreen Face Lotion SPF 50,1,"This stuff was so nasty I was embarrassed to be seen wearing it. Like I would not even leave my house with it on and I felt a certain level of shame when my boyfriend saw me. It&#039;s just a disgusting formula, like many of the US drugstore options. The white-cast is awful, it&#039;s thick and goopy, will not dry down...at all. This sunscreen will make your foundation cake up. I can not imagine wearing a full 1/4 tsp of this daily. Within minutes of applying 1/8th (just for testing) it felt like my face &quot;couldn&#039;t breathe&quot;. All the powder in the world could not set this formula to even a satin finish... it&#039;s pure grease.

My review is quite short but there&#039;s really nothing positive to note about this sunscreen other than I like that Cerave incorporated ceramides into the formula. Other than that... this is going in the trash.

ETA: This broke me out after just one day. I suspected it would based off how disgusting it felt on my skin but DAMN I can not stress enough what a god awful product this is.",2016-08-02T15:52:00.000Z,2908630,thumb/h/145/2_0_6_6_2409382.JPG,MUAsAlbino,5,Very Oily,Fair,Neutral,Blond,Wavy,Fine,Green,25-29,513
62,1622,CeraVe,22,Sunscreen,0,160671,Sunscreen Face Lotion SPF 50,1,"Heavy, smelly, leaves a white cast.  Awful product, horrible!  Doesn&#039;t rub in very well, stays on top of the skin and smells badly.   ",2016-06-08T15:00:00.000Z,2896690,thumb/h/145/2_0_6_6_2409382.JPG,picklemesoftly,0,Dry,Fair,Not Sure,Blond,Wavy,Medium,Blue,36-43,171
62,1622,CeraVe,22,Sunscreen,0,160671,Sunscreen Face Lotion SPF 50,2,"This inVisible word is so misleading!
I was looking for a cosmetically elegant physical sunscreen which i would be able to use under makeup. Unfortunately it leaves the qhitw cast which does not disappear no matter how much i rub it in.
When i put my sheer coverage bb cream on top it looks too cakey. 
The texsture is a liitle gritty too, not completely but there are some grits in there for whatever reason.
17$ is too much for such a poor texture.
PS. I mix thia spf with my bare minerals loose bronzer to get rid of white cast and it works perfect. No more white face plus pretty descent  protection, granted i dont go out in the time when sun is blazing.
",2016-05-28T21:27:00.000Z,2894041,thumb/h/145/2_0_6_6_2409382.JPG,Ispania,0,Combination,Fair-Medium,Not Sure,Brown,Wavy,Medium,Brown,30-35,113
62,1622,CeraVe,22,Sunscreen,2,160671,Sunscreen Face Lotion SPF 50,1,Invisible zinc? This is white face paint. ,2016-05-16T12:51:00.000Z,2891092,thumb/h/145/2_0_6_6_2409382.JPG,catherineathome,3,Dry,Unknown,Unknown,Blond,Unknown,Unknown,Green,44-55,1
62,1622,CeraVe,22,Sunscreen,5,160671,Sunscreen Face Lotion SPF 50,2,"I wanted to love this stuff, I really did. I tried, too. But I hate it.

I can&#039;t really use chemical sunscreens because they make my skin itch and burn, and eventually make me break out. So, I was on the hunt for a good physical sunscreen after having no reaction to Maybelline&#039;s BB creme that had titanium dioxide as the sunscreen. I did some searching and finally found this, and I remembered how many good things I&#039;d heard about CeraVe over the years, so I bought it.

Big mistake. This stuff will not work for my skin. I have combination, sensitive, acne prone skin and this stuff either slides around when I try to put on my primer and foundation, or it pills up. It also makes my foundation (every kind I&#039;ve tried) look scaly and flaky from the start, then it oxidizes super fast so I look orange after an hour or two, even with foundations I never had that problem with when I didn&#039;t use this stuff.

I don&#039;t mind the white-ish film, because it honestly helps my foundation look more like my skin when it&#039;s first applied (I&#039;m super pale, so sometimes my foundations are like half a shade off without mixing in some white), but the feeling of it is so heavy and weird. It&#039;s like I have a clay mask on my face or something.

Basically, it&#039;s like this for me...

Pros:
Sunscreen
I didn&#039;t have an allergic reaction
I don&#039;t think it made me break out worse

Cons:
Feels so heavy
Never seems to dry properly
Does not spread easily
Does not dry clear
Makes my makeup apply horribly, even with primer

If I had an emergency need for facial sunscreen, and this was the only product available, I would use it. But I wouldn&#039;t be happy about it.",2016-04-03T16:14:00.000Z,2879932,thumb/h/145/2_0_6_6_2409382.JPG,WyllowL,5,Sensitive,Fair,Neutral,Blond,Straight,Fine,Green,25-29,99
62,1622,CeraVe,22,Sunscreen,2,160671,Sunscreen Face Lotion SPF 50,2,"Very disappointed. Allergic reaction of some sort. 

I recently purchased Cerave PM moisturizer and have been very happy with it - it calmed my seasonal eczema down. 

I&#039;ve been using sunscreen every morning for about 15 years now. Admittedly, LA Roche Posey is very good, but the price point for me is a bit high.

So was happy that Cerave had an offering with high spf. I don&#039;t even kind that it is white for a bit as a dermatologist has told me before that you need to apply a sufficient amount, almost that is all white on your face. 

Here are my pros and cons:

Pros:

High SPF
Price Point

Cons:

It does leave a film and my makeup does not go on well. I use a brush to apply foundation so I feel the stickiness when holding the brush, and see my fingerprints if I do not wash my hands before foundation application. 
Whatever it contains, it has caused my face to react and become rashy. I can&#039;t see it but can feel it. It is almost like it is very dry and my skin has started flaking. And it stings. 

Overall, would not recommend due to my reaction, and the fact it states it is hypoallergenic. ",2016-03-05T13:06:00.000Z,2871802,thumb/h/145/2_0_6_6_2409382.JPG,kaycee66,2,Sensitive,Fair,Unknown,Black,Unknown,Unknown,Brown,36-43,46
62,1622,CeraVe,22,Sunscreen,3,160671,Sunscreen Face Lotion SPF 50,2,"I&#039;m not surprised by the low rating! The claim &quot;invisible zinc&#039; is a joke. I have pretty fair skin, and the white cast is crazy. Yes, it is possible to really work it in if you use a little and really press into the skin...but using so little does not give adequate sun protection. Also, when I have dry skin this disaster turns into a catastrophe. White cast will not fade and flakes everywhere. 

",2016-01-22T23:41:00.000Z,2859387,thumb/h/145/2_0_6_6_2409382.JPG,marinageorge21,3,Oily,Fair,Neutral,Brunette,Wavy,Medium,Green,25-29,257
62,1622,CeraVe,22,Sunscreen,0,160671,Sunscreen Face Lotion SPF 50,1,I bought this product because of the rating it got on beautyPedia (paulas choice) and because of the great skin ingredients.I don&#039;t care for the chemical sunscreens as much as the sun blockers. I love the Cera Ve cleansers and moisturizers bit this sunscreen is not good. The first time I used it I put a dime size amount in the palm of my hands and rubbed it between my fingers that&#039;s when I felt little gritty pills like things. Like there was a micro scrub in it. I thought maybe I used touch also I notice there was a white film (not to bad) on my face that people thought I was sick.the next day I put it on with a beauty blender. That left little scrubbies in my blender so I had to buy a new one. I thought maybe it was mixing with the aha&#039;s that I use so I experimented for a week. One day I used the cleanser and moisturizer then put on sunscreen still had the gritty sensation and the white cast. The next day I used a cleanser and the sunscreen still had the cast and you could really see it in my eyebrows. I&#039;m going to keep the product because I&#039;m not throwing it away at $12 a tube however I think I&#039;m only going to use it in the summer time at the pool that way is expected to have a white face. But I&#039;m going to go back to my Neutrogena liquid sunscreen for under my makeup. But if you haven&#039;t already you need to try the Cera Ve cleansers and moisturizers they are awesome. .. not greasy or oily and they work great.,2016-01-20T07:37:00.000Z,2858522,thumb/h/145/2_0_6_6_2409382.JPG,Msjen72,0,Normal,Fair-Medium,Neutral,Brown,Straight,Fine,Hazel,44-55,4
62,1622,CeraVe,22,Sunscreen,1,160671,Sunscreen Face Lotion SPF 50,1,"Almost $14 for 2oz

IT WILL LEAVE YOUR FACE WHITE. NO, I DIDN&#039;T APPLY TOO MUCH. 

It has a thicker consistency than Murad matte primer and it will NOT spread easily or evenly. 

No smell or irritation, feels like nothing on skin but looks straight up WHITE on the face!!",2015-09-08T15:48:00.000Z,2824357,thumb/h/145/2_0_6_6_2409382.JPG,celina5847,3,Combination,Medium,Unknown,Brown,Unknown,Unknown,Brown,36-43,200
62,1622,CeraVe,22,Sunscreen,2,160671,Sunscreen Face Lotion SPF 50,1,"This has got to be one of the worst sunscreens I&#039;ve ever used. It leaves a strong white grey cast on the skin. It&#039;s not completely absorbed by the skin no matter how much rubbing or waiting time is allowed for. It definitely shows up pores on the skin - see the photo I uploaded of my arm. I used my usual daily foundation over the top of it (Cover Girl Ready Set Gorgeous) and it made look so cakey, matte and flat. This foundation is otherwise quite natural looking. The only positive I can find is that it didn&#039;t irritate my skin or make it feel greasy. Definitely not a rebuy. Awful!",2015-08-27T15:15:00.000Z,2821271,thumb/h/145/2_0_6_6_2409382.JPG,niwhai,2,Combination,Other,Not Sure,Brunette,Other,Other,Hazel,36-43,2
62,1622,CeraVe,22,Sunscreen,1,160671,Sunscreen Face Lotion SPF 50,1,"My dermatologist recommends cerave with ceramics spf for daily wear which is great but I wanted to try this one because I believe it&#039;s new. Not light weight at all, it leaves a horrible super white ghost like residue even if you blend it out well. It casts an awful grey cast under foundation. No cerave this in light weight and it&#039;s in the face isle not body isle so I know this is geared towards the face. ",2015-07-28T11:41:00.000Z,2811878,thumb/h/145/2_0_6_6_2409382.JPG,fatima323,1,Other,Other,Unknown,Other,Unknown,Unknown,Other,19-24,41
62,1622,CeraVe,22,Sunscreen,3,160671,Sunscreen Face Lotion SPF 50,1,"This sunscreen smells like some. sort of veterinary medicine &amp; is like smearing desitin ointment on your face. It is awful. I would. never buy this product again. 



",2015-06-29T09:32:00.000Z,2802847,thumb/h/145/2_0_6_6_2409382.JPG,Honin,3,Sensitive,Fair,Not Sure,Blond,Wavy,Fine,Blue,44-55,11
62,1622,CeraVe,22,Sunscreen,1,160671,Sunscreen Face Lotion SPF 50,1,"Used this once and am returning it. It is not clear on me and I am very pale and the niacinamide irritated my sensitive eyelid. I felt like if I used it again, my lids would get red and dry. Pity since the ingredient list has some useful anti-aging ingredients besides decent sunscreen ingredients.",2015-06-24T18:29:00.000Z,2801527,thumb/h/145/2_0_6_6_2409382.JPG,Andee,1,Normal,Fair,Warm,Red,Wavy,Fine,Green,56 & Over,313
62,1622,CeraVe,22,Sunscreen,3,160671,Sunscreen Face Lotion SPF 50,1,"If I could give this 0 lippies, I would.  Lots of other reviewers complained of this leaving a white cast, and since I am extremely fair I figured this would not be a problem.  I was wrong.  This feels like you are spreading Elmer&#039;s Glue on your face.  It is so sticky, and you cannot get it to sink in no matter how hard you try.  It leaves a terrible white cast and made my face irritated.  I usually love Cera Ve products, but this one is definitely a dud.  This would not work for any skin type.",2015-05-15T12:20:00.000Z,2789330,thumb/h/145/2_0_6_6_2409382.JPG,jordina229,3,Oily,Fair,Cool,Blond,Wavy,Coarse,Other,19-24,111
62,1622,CeraVe,22,Sunscreen,3,160671,Sunscreen Face Lotion SPF 50,1,"Unfortunately I did not read the reviews before buying this. I agree with everything the other negative reviews have said. This sunscreen is a thick and pasty, and despite the invisible zinc claim, the white cast from this is terrible. My skin is light as it is, and this leaves a noticeable white mask over it. No amount of rubbing helps. It also feels heavy and makes my skin feel a little irritated and itchy. Also it does not contain added fragrance, but the scent that the ingredients give off makes it smell faintly of paint. Weird and gross. Not a fan of this one at all.",2015-05-09T12:47:00.000Z,2787593,thumb/h/145/2_0_6_6_2409382.JPG,rustybag,3,Combination,Fair,Not Sure,Brown,Other,Other,Brown,30-35,253
62,1622,CeraVe,22,Sunscreen,5,160671,Sunscreen Face Lotion SPF 50,1,"Like many of the reviewers below, I have several CeraVe products and bought this thinking I couldn&#039;t go wrong. Broad spectrum high SPF protection, lightweight, dries clear, water resistant for 80 minutes, and contains ceramides and niacinamide? Great! Except NOOooooo. Not good at all. 

I&#039;ve tried several times to make this work and have given up. The formula is terrible and I don&#039;t know how this even made it out of product testing, or who wrote the ludicrous claims on the packaging. 

Firstly, it says this product &quot;is like no other sunscreen you&#039;ve ever experienced.&quot; Well I suppose that&#039;s true, because I&#039;ve never had any other sunscreen make me look like a dry, flaky ghost the way this one does. Then it describes the product as a &quot;lightweight formula that spreads easily and dries with a clear finish.&quot; LIES. It&#039;s a very thick white cream that dries much too quickly as you try to spread it. Even when I try to work with it in small patches, it&#039;s almost impossible to avoid streaks. And once it dries, anything you do to fix the streaks will make it flake and look worse. What part of &quot;clear&quot; actually means opaque? If it had a clear finish, my husband wouldn&#039;t have said, &quot;Whoah you look like a geisha!&quot; the moment he saw me with this on. The package also says, &quot;May also reduce skin redness.&quot; Well yes, it may happen to reduce redness, as it also reduces any other color on your face, including your actual skin color, to pasty whiteness. 

I tried applying it to bare skin and putting makeup over it to put some color back in my face. But unless I caked foundation and bronzer over, you could still see the streaks. Plus it felt like I was wearing a mask. I tried mixing it with my foundation, to make a tinted sunscreen. I still came out looking several shades whiter. I tried putting on less, but then I was sacrificing protection and it was still hard to spread and streaky.  

There are some pros, to be fair. It&#039;s fragrance free and didn&#039;t irritate my sensitive skin. And I have no doubt that it really does provide the protection it claims. But I will only be wearing it when I go out for a run, or other outdoor sports, when I don&#039;t care what I look like. For a more expensive sunscreen, it&#039;s really disappointing. It finally spurred me to order some Asian sunscreens from Amazon, because it seems that the Asian brands actually know how to make highly protective sunscreens that you won&#039;t hate wearing. ",2015-05-02T22:20:00.000Z,2785537,thumb/h/145/2_0_6_6_2409382.JPG,sunshowers,6,Sensitive,Fair-Medium,Warm,Black,Straight,Fine,Brown,30-35,109
